{
  "scenario_id": "scenario_006_weak",
  "evaluation_item_id": "duke_cackalacky_w_001",
  "case_id": "duke_cackalacky_construction",
  "candidate_model": {
    "model": "phi-4",
    "temperature": 0.7,
    "seed": 42
  },
  "candidate_profile": {
    "performance_level": 2,
    "performance_label": "weak",
    "description": "The candidate understands that market entry is needed and may get part of the market-sizing right, but the analysis is incomplete, the Texas entry logic is weakly structured, and the final recommendation is only partially convincing.",
    "behaviour_rules": [
      "Recognize that the company likely needs to enter a new market to reach the growth target, but define the target only loosely.",
      "Ask some relevant questions about the business and public-school funding, but keep them broad.",
      "Attempt the market-sizing math, but do not always connect it clearly to the final choice.",
      "Realize that Texas is attractive, but do not compare Texas and Georgia especially rigorously.",
      "Use a simple market-entry framework, but do not apply Build/Borrow/Buy in a disciplined way.",
      "Notice some competitive fragmentation in Texas, but underplay the significance of recent entrants and acquisition.",
      "Mention a few risks such as personnel or regulation, but not with strong mitigation logic."
    ],
    "answer_style": {
      "length": "short",
      "confidence": "low",
      "clarity": "medium",
      "business_vocabulary": "basic"
    }
  },
  "ground_truth": {
    "reference_scores": {
      "case_opening": 2,
      "case_structure": 2,
      "case_math_answer": 2,
      "case_creative_answer": 2,
      "final_recommendation": 2,
      "overall_structure": 2,
      "overall_problem_solving": 2,
      "overall_communication": 2,
      "overall": 2
    },
    "expected_issues": [
      "Only partially quantifies the market opportunities against the $20M goal.",
      "Does not clearly explain why Texas may be preferable to Georgia despite both meeting the target.",
      "Applies market-entry logic only loosely.",
      "Underdevelops the acquisition angle despite the competitive evidence.",
      "Recommendation and risk mitigation remain somewhat generic."
    ],
    "expected_feedback_points": [
      "Tie the math more explicitly to the decision criteria.",
      "Compare Texas and Georgia more sharply after sizing the opportunities.",
      "Use a structured entry framework such as Build/Borrow/Buy.",
      "Explain more clearly what the competitive landscape implies for entry mode.",
      "Make the final recommendation and mitigation plan more specific."
    ]
  }
}
