{
  "scenario_id": "scenario_004_excellent",
  "evaluation_item_id": "harvard_juice_producer_ex_001",
  "case_id": "harvard_02_juice_producer",
  "candidate_model": {
    "model": "phi-4",
    "temperature": 0.7,
    "seed": 42
  },
  "candidate_profile": {
    "performance_level": 5,
    "performance_label": "excellent",
    "description": "The candidate rapidly identifies the real issue: the company introduced a more expensive gallon format, priced it too aggressively, allocated costs incorrectly, and then shifted its mix toward the underpriced product. The final recommendation is crisp and directly tied to activity-based costing and repricing.",
    "behaviour_rules": [
      "Begin with a concise recap and immediately frame the problem as a profitability issue driven by cost and pricing, not demand.",
      "Ask two or three hypothesis-driven questions on package pricing, production cost, labor requirements, and cost allocation.",
      "Use a clear framework that confirms revenue strength, isolates the incremental economics of gallons, and tests how costs are assigned across products.",
      "Recognize that the new gallon format combines a lower per-ounce selling price with higher packaging and labor cost.",
      "Explicitly state that this creates negative unit economics if costs are not properly assigned.",
      "Identify that averaging factory costs across cartons and gallons is the key accounting mistake.",
      "Use the 60% gallon sales mix to explain why profit falls as sales rise: the company is selling more of the mispriced product.",
      "Conclude that the business needs activity-based costing and product-level repricing, especially for plastic gallons."
    ],
    "answer_style": {
      "length": "medium",
      "confidence": "high",
      "clarity": "high",
      "business_vocabulary": "professional"
    }
  },
  "ground_truth": {
    "reference_scores": {
      "case_opening": 5,
      "case_structure": 5,
      "case_math_answer": 5,
      "case_creative_answer": "not_tested",
      "final_recommendation": 5,
      "overall_structure": 5,
      "overall_problem_solving": 5,
      "overall_communication": 5,
      "overall": 5
    },
    "expected_issues": [
      "May not calculate exact product margins explicitly because the case is primarily diagnostic rather than exhibit-driven math-heavy.",
      "Could still be pushed for more implementation sequencing after the costing review, though the core answer should already be excellent."
    ],
    "expected_feedback_points": [
      "Excellent recognition that the problem is on the cost and pricing side, not the demand side.",
      "Excellent diagnosis of the gallon format's higher packaging and labor costs.",
      "Excellent identification of lower per-ounce pricing on the more expensive product.",
      "Excellent explanation of the cost-allocation error from averaging factory costs across all units.",
      "Excellent linkage between the 60% gallon mix and declining profitability.",
      "Excellent recommendation to conduct activity-based costing and reprice gallons appropriately."
    ]
  }
}
