{
  "scenario_id": "scenario_006_good",
  "evaluation_item_id": "duke_cackalacky_g_001",
  "case_id": "duke_cackalacky_construction",
  "candidate_model": {
    "model": "phi-4",
    "temperature": 0.7,
    "seed": 42
  },
  "candidate_profile": {
    "performance_level": 3,
    "performance_label": "good",
    "description": "The candidate correctly sizes the market opportunities, recognizes that Texas and Georgia both meet the target, and gives a sensible Texas entry recommendation with reasonable discussion of competition and risks, though the synthesis is not top-tier.",
    "behaviour_rules": [
      "Begin with a clear recap and translate doubling revenue into an additional $20M goal.",
      "Use a workable framework covering market selection, entry mode, and implementation risks.",
      "Calculate the projected 2019 market opportunity and penetration-based revenue for each state with mostly correct logic.",
      "Recognize that Texas and Georgia can both meet the target while Michigan cannot.",
      "Choose Texas as the stronger opportunity based on larger absolute market size and projected revenue potential.",
      "Analyze the Texas market as fragmented and notice that recent entrants have grown quickly.",
      "Recognize acquisition as a plausible entry path, though not necessarily articulate it in the strongest possible way.",
      "Provide a reasonable recommendation with some risks and mitigation ideas."
    ],
    "answer_style": {
      "length": "medium",
      "confidence": "medium",
      "clarity": "medium",
      "business_vocabulary": "professional"
    }
  },
  "ground_truth": {
    "reference_scores": {
      "case_opening": 3,
      "case_structure": 3,
      "case_math_answer": 3,
      "case_creative_answer": 3,
      "final_recommendation": 3,
      "overall_structure": 3,
      "overall_problem_solving": 3,
      "overall_communication": 3,
      "overall": 3
    },
    "expected_issues": [
      "Gets to the right answer, but may not articulate the rationale for Texas versus Georgia especially sharply.",
      "May notice acquisition as a good option without fully benchmarking it against other entry paths.",
      "Risk mitigation is reasonable but not deeply prioritized."
    ],
    "expected_feedback_points": [
      "Good conversion of the growth objective into a revenue target.",
      "Good market-sizing and state selection analysis.",
      "Good read of the fragmented Texas market and the role of recent high-growth entrants.",
      "Reasonable recommendation to enter Texas with a structured approach to market entry and risk management.",
      "To improve further, sharpen synthesis, entry-mode recommendation, and mitigation detail."
    ]
  }
}
