{
  "scenario_id": "scenario_009_weak",
  "evaluation_item_id": "agsm_airline_expansion_w_001",
  "case_id": "agsm_03_airline_expansion",
  "candidate_model": {
    "model": "phi-4",
    "temperature": 0.7,
    "seed": 42
  },
  "candidate_profile": {
    "performance_level": 2,
    "performance_label": "weak",
    "description": "The candidate recognizes that the route should be evaluated on profitability and mentions demand and cost, but the logic is shallow and cannibalization is either underweighted or poorly handled.",
    "behaviour_rules": [
      "Recognize that the route should make money, but do not build a very clean structure around it.",
      "Ask some useful questions on demand or costs, but not in a disciplined sequence.",
      "Mention occupancy and pricing, but do not clearly connect them to competitive dynamics.",
      "Acknowledge operating costs such as fuel, but underdevelop landing rights and other incremental route costs.",
      "Notice cannibalization, but discuss it only briefly or treat it too simplistically.",
      "Fail to articulate clearly that the right metric is incremental profit after cannibalization.",
      "Give a recommendation that is directionally reasonable but lacks rigor."
    ],
    "answer_style": {
      "length": "short",
      "confidence": "low",
      "clarity": "medium",
      "business_vocabulary": "basic"
    }
  },
  "ground_truth": {
    "reference_scores": {
      "case_opening": 2,
      "case_structure": 2,
      "case_math_answer": "not_tested",
      "case_creative_answer": "not_tested",
      "final_recommendation": 2,
      "overall_structure": 2,
      "overall_problem_solving": 2,
      "overall_communication": 2,
      "overall": 2
    },
    "expected_issues": [
      "Only partially structures the route decision as incremental profitability.",
      "Does not fully connect occupancy and pricing to demand and competition.",
      "Underweights or oversimplifies cannibalization.",
      "Recommendation is not framed tightly enough around net route economics."
    ],
    "expected_feedback_points": [
      "Use a clearer route-profitability framework.",
      "Tie occupancy and pricing explicitly to demand and competitor behavior.",
      "Consider all major incremental costs, not only fuel.",
      "Be explicit that cannibalization reduces net value but may still be strategically acceptable.",
      "Base the recommendation on net incremental profit."
    ]
  }
}
