{
  "scenario_id": "scenario_001_weak",
  "evaluation_item_id": "duke_activist_action_w_001",
  "case_id": "duke_activist_action",
  "candidate_model": {
    "model": "phi-4",
    "temperature": 0.7,
    "seed": 42
  },
  "candidate_profile": {
    "performance_level": 2,
    "performance_label": "weak",
    "description": "The candidate understands that the company faces activist pressure, but responds with a shallow and weakly prioritized framework, incomplete exhibit interpretation, and a recommendation that is only partially supported.",
    "behaviour_rules": [
      "Acknowledge the activist investor angle, but do not sharply separate short-term shareholder demands from long-term company goals.",
      "Ask one or two basic clarification questions, but keep them generic rather than hypothesis-driven.",
      "Use some structure, but let the buckets remain broad and only loosely prioritized.",
      "Notice that the supply chain option has financial upside, but struggle to connect timing to activist expectations without prompting.",
      "Give some reasonable objections to outsourcing, but do not fully articulate the brand, logistics, and talent trade-offs.",
      "Mention divestiture as one option, but hesitate to prioritize it decisively until late in the case.",
      "End with a recommendation that is somewhat correct but underdeveloped, with limited risks and next steps."
    ],
    "answer_style": {
      "length": "short",
      "confidence": "low",
      "clarity": "medium",
      "business_vocabulary": "basic"
    }
  },
  "ground_truth": {
    "reference_scores": {
      "case_opening": 2,
      "case_structure": 2,
      "case_math_answer": 2,
      "case_creative_answer": 2,
      "final_recommendation": 2,
      "overall_structure": 2,
      "overall_problem_solving": 2,
      "overall_communication": 2,
      "overall": 2
    },
    "expected_issues": [
      "Only partially separates short-term activist demands from long-term strategic value.",
      "Framework is generic and weakly prioritized.",
      "Understands the supply chain NPV at a surface level but does not quickly conclude that the timing makes it unattractive for the activist investor.",
      "Rejects some low-cost-country options but without strong, case-specific reasoning.",
      "Recognizes divestiture as plausible but does not strongly support Silky Sweets as the best option.",
      "Recommendation lacks synthesis, risks, and concrete next steps."
    ],
    "expected_feedback_points": [
      "Sharpen the initial framing by explicitly contrasting short-term activist value with long-term company health.",
      "Use a more structured and prioritized framework.",
      "Interpret Exhibit 1 through the activist time horizon, not only the NPV result.",
      "Give clearer reasons why outsourcing is not a good fit for the client's needs.",
      "Prioritize divestiture more decisively and support it with stronger evidence.",
      "Conclude with a firmer recommendation, explicit risk, and practical next steps."
    ]
  }
}
