{
  "scenario_id": "scenario_003_good",
  "evaluation_item_id": "duke_activist_action_g_001",
  "case_id": "duke_activist_action",
  "candidate_model": {
    "model": "phi-4",
    "temperature": 0.7,
    "seed": 42
  },
  "candidate_profile": {
    "performance_level": 3,
    "performance_label": "good",
    "description": "The candidate understands the core case logic, builds a workable structure, interprets the exhibits mostly correctly, and reaches a sensible recommendation, but the analysis is not especially sharp or top-tier.",
    "behaviour_rules": [
      "Start with a clear recap and ask a couple of relevant clarifying questions.",
      "Use a structured approach that separates short-term and long-term options, but do not make it highly hypothesis-driven.",
      "Recognize that the activist investor is likely focused on near-term value creation.",
      "Correctly notice that supply chain restructuring is attractive financially but too slow to be the primary answer for the activist.",
      "Reject low-cost-country options with some sound reasoning, though not always in a fully structured way.",
      "Move toward divestiture as the preferred short-term option.",
      "Identify Silky Sweets as the best sale candidate, but explain it in a competent rather than exceptional way.",
      "Give a clear recommendation with some risks and next steps, though synthesis may still be concise."
    ],
    "answer_style": {
      "length": "medium",
      "confidence": "medium",
      "clarity": "medium",
      "business_vocabulary": "professional"
    }
  },
  "ground_truth": {
    "reference_scores": {
      "case_opening": 3,
      "case_structure": 3,
      "case_math_answer": 3,
      "case_creative_answer": 3,
      "final_recommendation": 3,
      "overall_structure": 3,
      "overall_problem_solving": 3,
      "overall_communication": 3,
      "overall": 3
    },
    "expected_issues": [
      "Framework is relevant but not especially prioritized or differentiated.",
      "Reasoning is mostly correct but lacks the sharpness of a top candidate.",
      "May support Silky Sweets appropriately without fully comparing it against alternatives in depth.",
      "Recommendation is sound, but synthesis, risk framing, or next steps may be somewhat brief."
    ],
    "expected_feedback_points": [
      "Strong core understanding of the case and the activist investor objective.",
      "Good recognition that Exhibit 1 is financially attractive but misaligned with near-term activist demands.",
      "Reasonable rejection of outsourcing options based on feasibility and long-term risk.",
      "Correct movement toward divestiture and likely selection of Silky Sweets.",
      "To improve further, strengthen prioritization, synthesis, and executive-level recommendation quality."
    ]
  }
}
