{
  "scenario_id": "scenario_003_weak",
  "evaluation_item_id": "agsm_chilled_beverages_w_001",
  "case_id": "agsm_01_chilled_beverages",
  "candidate_model": {
    "model": "phi-4",
    "temperature": 0.7,
    "seed": 42
  },
  "candidate_profile": {
    "performance_level": 2,
    "performance_label": "weak",
    "description": "The candidate understands that the chilled juice business is structurally under pressure, but the diagnosis is shallow. They partly identify competition and cost issues, yet they do not integrate pricing pressure and synergies well and give a recommendation that remains tentative.",
    "behaviour_rules": [
      "Ask one or two useful clarification questions, but keep them broad rather than sharply hypothesis-driven.",
      "Recognize that the problem is not simply low sales, but do not build a clean, prioritized explanation of why chilled juices underperform.",
      "Notice that larger competitors have advantages, but explain scale and promotion economics only superficially.",
      "Mention that the product may be more expensive to make, but do not fully connect the elaborate blend to the market's price sensitivity.",
      "Acknowledge that there could be synergies with juice boxes and frozen concentrate, but do not weigh them strongly enough in the final decision.",
      "Consider keeping or selling the business for too long before landing on a recommendation.",
      "End with a recommendation that is somewhat reasonable but still under-supported and light on next steps."
    ],
    "answer_style": {
      "length": "short",
      "confidence": "low",
      "clarity": "medium",
      "business_vocabulary": "basic"
    }
  },
  "ground_truth": {
    "reference_scores": {
      "case_opening": 2,
      "case_structure": 2,
      "case_math_answer": 2,
      "case_creative_answer": "not_tested",
      "final_recommendation": 2,
      "overall_structure": 2,
      "overall_problem_solving": 2,
      "overall_communication": 2,
      "overall": 2
    },
    "expected_issues": [
      "Only partially explains why market leaders can remain profitable while the client struggles.",
      "Does not clearly connect scale, promotions, couponing, and trade spend to competitive disadvantage.",
      "Underdevelops the point that higher-cost flavorings are a problem in a price-sensitive category with similar branded price points.",
      "Does not weigh the advertising and manufacturing synergies strongly enough when evaluating a sale.",
      "Recommendation lacks conviction and does not clearly prioritize reworking the business over selling it."
    ],
    "expected_feedback_points": [
      "Build a clearer causal chain from scale disadvantage to lower promotional support and weaker economics.",
      "Connect ingredient mix and pricing constraints more explicitly.",
      "Treat synergies across chilled, juice boxes, and frozen concentrate as a major strategic factor.",
      "Move more decisively toward keeping the business and reworking costs rather than staying undecided.",
      "Give a more specific recommendation with practical next steps."
    ]
  }
}
