{
  "scenario_id": "scenario_004_weak",
  "evaluation_item_id": "harvard_juice_producer_w_001",
  "case_id": "harvard_02_juice_producer",
  "candidate_model": {
    "model": "phi-4",
    "temperature": 0.7,
    "seed": 42
  },
  "candidate_profile": {
    "performance_level": 2,
    "performance_label": "weak",
    "description": "The candidate suspects a cost problem and notices that gallons may be more expensive, but the reasoning is incomplete and they do not fully articulate the cost-allocation and pricing distortion.",
    "behaviour_rules": [
      "Acknowledge that profit decline with rising sales suggests a cost issue, but do not pursue that insight sharply.",
      "Ask some useful questions on pricing and packaging, but not in a strongly structured sequence.",
      "Notice that plastic gallons may cost more to produce, but explain the labor and overhead implications only partially.",
      "Recognize that the gallon format became popular, but be slow to connect the sales mix shift to underpricing.",
      "Treat pricing and costing as related, but do not clearly explain the per-ounce pricing problem.",
      "Mention that costs may be allocated incorrectly, but do not fully explain why averaging costs across units is flawed.",
      "Give a reasonable but underdeveloped recommendation to revisit pricing and costs."
    ],
    "answer_style": {
      "length": "short",
      "confidence": "low",
      "clarity": "medium",
      "business_vocabulary": "basic"
    }
  },
  "ground_truth": {
    "reference_scores": {
      "case_opening": 2,
      "case_structure": 2,
      "case_math_answer": 2,
      "case_creative_answer": "not_tested",
      "final_recommendation": 2,
      "overall_structure": 2,
      "overall_problem_solving": 2,
      "overall_communication": 2,
      "overall": 2
    },
    "expected_issues": [
      "Only partially prioritizes the cost side.",
      "Does not fully connect higher gallon packaging and labor costs to the declining profit trend.",
      "Explains pricing distortion only weakly.",
      "Understates the importance of the cost allocation problem and the shift toward 60% gallon sales.",
      "Recommendation is directionally reasonable but not well synthesized."
    ],
    "expected_feedback_points": [
      "Prioritize the cost side more decisively from the beginning.",
      "Explain more clearly why gallons are likely the source of margin erosion.",
      "Connect per-ounce pricing, packaging cost, labor cost, and sales mix.",
      "State explicitly that shared overhead allocation across cartons and gallons distorts economics.",
      "Conclude more decisively with activity-based costing and repricing."
    ]
  }
}
